{
  "candidate_count": 5,
  "display_candidates": [
    {
      "base_opportunity_score": 0.631,
      "candidate_label": "Top Exploration Candidate",
      "display_to_operator": true,
      "hypothesis_id": "H-001",
      "normalized_signals": {
        "contradiction_importance": 0.9,
        "cross_domain_analogy_strength": 1.0,
        "discovery_gap_priority": 0.581,
        "feasibility_score": 0.75,
        "novelty_score": 0.25,
        "research_support_strength": 0.902,
        "technology_frontier_proximity": 0.35
      },
      "opportunity_score": 0.644,
      "opportunity_zone": "agent",
      "origin": "domain",
      "platform_alignment_score": 0.565,
      "priority_adjustment": 0.013,
      "rank": 1,
      "recommended_path_id": "P-001",
      "recommended_path_title": "Path for Agent invention pathway",
      "title": "Agent invention pathway"
    },
    {
      "base_opportunity_score": 0.557,
      "candidate_label": "Top Exploration Candidate",
      "display_to_operator": true,
      "hypothesis_id": "H-002",
      "normalized_signals": {
        "contradiction_importance": 0.9,
        "cross_domain_analogy_strength": 0.8,
        "discovery_gap_priority": 0.581,
        "feasibility_score": 0.75,
        "novelty_score": 0.0,
        "research_support_strength": 0.902,
        "technology_frontier_proximity": 0.35
      },
      "opportunity_score": 0.57,
      "opportunity_zone": "model",
      "origin": "domain",
      "platform_alignment_score": 0.565,
      "priority_adjustment": 0.013,
      "rank": 2,
      "recommended_path_id": "P-002",
      "recommended_path_title": "Path for Model invention pathway",
      "title": "Model invention pathway"
    },
    {
      "base_opportunity_score": 0.543,
      "candidate_label": "Top Exploration Candidate",
      "display_to_operator": true,
      "hypothesis_id": "H-003",
      "normalized_signals": {
        "contradiction_importance": 0.9,
        "cross_domain_analogy_strength": 0.6,
        "discovery_gap_priority": 0.581,
        "feasibility_score": 0.75,
        "novelty_score": 0.0,
        "research_support_strength": 0.902,
        "technology_frontier_proximity": 0.35
      },
      "opportunity_score": 0.556,
      "opportunity_zone": "agents",
      "origin": "domain",
      "platform_alignment_score": 0.565,
      "priority_adjustment": 0.013,
      "rank": 3,
      "recommended_path_id": "P-003",
      "recommended_path_title": "Path for Agents invention pathway",
      "title": "Agents invention pathway"
    },
    {
      "base_opportunity_score": 0.529,
      "candidate_label": "Top Exploration Candidate",
      "display_to_operator": true,
      "hypothesis_id": "H-004",
      "normalized_signals": {
        "contradiction_importance": 0.9,
        "cross_domain_analogy_strength": 0.4,
        "discovery_gap_priority": 0.581,
        "feasibility_score": 0.75,
        "novelty_score": 0.0,
        "research_support_strength": 0.902,
        "technology_frontier_proximity": 0.35
      },
      "opportunity_score": 0.542,
      "opportunity_zone": "verification",
      "origin": "domain",
      "platform_alignment_score": 0.565,
      "priority_adjustment": 0.013,
      "rank": 4,
      "recommended_path_id": "P-004",
      "recommended_path_title": "Path for Verification invention pathway",
      "title": "Verification invention pathway"
    },
    {
      "base_opportunity_score": 0.525,
      "candidate_label": "Top Exploration Candidate",
      "display_to_operator": true,
      "hypothesis_id": "H-005",
      "normalized_signals": {
        "contradiction_importance": 0.9,
        "cross_domain_analogy_strength": 0.333,
        "discovery_gap_priority": 0.581,
        "feasibility_score": 0.75,
        "novelty_score": 0.0,
        "research_support_strength": 0.902,
        "technology_frontier_proximity": 0.35
      },
      "opportunity_score": 0.538,
      "opportunity_zone": "governance",
      "origin": "domain",
      "platform_alignment_score": 0.565,
      "priority_adjustment": 0.013,
      "rank": 5,
      "recommended_path_id": "P-005",
      "recommended_path_title": "Path for Governance invention pathway",
      "title": "Governance invention pathway"
    }
  ],
  "presentation_limit": 5,
  "ranked_hypotheses": [
    {
      "base_opportunity_score": 0.631,
      "candidate_label": "Top Exploration Candidate",
      "display_to_operator": true,
      "hypothesis_id": "H-001",
      "normalized_signals": {
        "contradiction_importance": 0.9,
        "cross_domain_analogy_strength": 1.0,
        "discovery_gap_priority": 0.581,
        "feasibility_score": 0.75,
        "novelty_score": 0.25,
        "research_support_strength": 0.902,
        "technology_frontier_proximity": 0.35
      },
      "opportunity_score": 0.644,
      "opportunity_zone": "agent",
      "origin": "domain",
      "platform_alignment_score": 0.565,
      "priority_adjustment": 0.013,
      "rank": 1,
      "recommended_path_id": "P-001",
      "recommended_path_title": "Path for Agent invention pathway",
      "title": "Agent invention pathway"
    },
    {
      "base_opportunity_score": 0.557,
      "candidate_label": "Top Exploration Candidate",
      "display_to_operator": true,
      "hypothesis_id": "H-002",
      "normalized_signals": {
        "contradiction_importance": 0.9,
        "cross_domain_analogy_strength": 0.8,
        "discovery_gap_priority": 0.581,
        "feasibility_score": 0.75,
        "novelty_score": 0.0,
        "research_support_strength": 0.902,
        "technology_frontier_proximity": 0.35
      },
      "opportunity_score": 0.57,
      "opportunity_zone": "model",
      "origin": "domain",
      "platform_alignment_score": 0.565,
      "priority_adjustment": 0.013,
      "rank": 2,
      "recommended_path_id": "P-002",
      "recommended_path_title": "Path for Model invention pathway",
      "title": "Model invention pathway"
    },
    {
      "base_opportunity_score": 0.543,
      "candidate_label": "Top Exploration Candidate",
      "display_to_operator": true,
      "hypothesis_id": "H-003",
      "normalized_signals": {
        "contradiction_importance": 0.9,
        "cross_domain_analogy_strength": 0.6,
        "discovery_gap_priority": 0.581,
        "feasibility_score": 0.75,
        "novelty_score": 0.0,
        "research_support_strength": 0.902,
        "technology_frontier_proximity": 0.35
      },
      "opportunity_score": 0.556,
      "opportunity_zone": "agents",
      "origin": "domain",
      "platform_alignment_score": 0.565,
      "priority_adjustment": 0.013,
      "rank": 3,
      "recommended_path_id": "P-003",
      "recommended_path_title": "Path for Agents invention pathway",
      "title": "Agents invention pathway"
    },
    {
      "base_opportunity_score": 0.529,
      "candidate_label": "Top Exploration Candidate",
      "display_to_operator": true,
      "hypothesis_id": "H-004",
      "normalized_signals": {
        "contradiction_importance": 0.9,
        "cross_domain_analogy_strength": 0.4,
        "discovery_gap_priority": 0.581,
        "feasibility_score": 0.75,
        "novelty_score": 0.0,
        "research_support_strength": 0.902,
        "technology_frontier_proximity": 0.35
      },
      "opportunity_score": 0.542,
      "opportunity_zone": "verification",
      "origin": "domain",
      "platform_alignment_score": 0.565,
      "priority_adjustment": 0.013,
      "rank": 4,
      "recommended_path_id": "P-004",
      "recommended_path_title": "Path for Verification invention pathway",
      "title": "Verification invention pathway"
    },
    {
      "base_opportunity_score": 0.525,
      "candidate_label": "Top Exploration Candidate",
      "display_to_operator": true,
      "hypothesis_id": "H-005",
      "normalized_signals": {
        "contradiction_importance": 0.9,
        "cross_domain_analogy_strength": 0.333,
        "discovery_gap_priority": 0.581,
        "feasibility_score": 0.75,
        "novelty_score": 0.0,
        "research_support_strength": 0.902,
        "technology_frontier_proximity": 0.35
      },
      "opportunity_score": 0.538,
      "opportunity_zone": "governance",
      "origin": "domain",
      "platform_alignment_score": 0.565,
      "priority_adjustment": 0.013,
      "rank": 5,
      "recommended_path_id": "P-005",
      "recommended_path_title": "Path for Governance invention pathway",
      "title": "Governance invention pathway"
    }
  ],
  "type": "DECISION_RANKING_REPORT"
}
